id,borough_county,primary_sector,entity_trade_name,annual_turnover,entity_status,country_of_primary_operation,Coal_Consumption_By_Sector(toe),Electricity_Consumption_By_Structure(toe),Gas_Consumption_By_Structure(toe),Geographic Code,Local Authority,NG_Consumption_By_Sector(toe),Petrol_Consumption_By_Sector(toe),Region,SIC Group,Section,Sector,Structure_Type
440,Brent,47 : Retail,"Hussain-Elliott, Roberts-Miller, Brown, Foster, Harris",0-632k,1,United Kingdom,0,2.635591468,2.112707296,E09000005,Brent,0.251019236,0,,47,G,Retail,Shop
441,"Bristol, City of",68 : Property,"Mills, Bishop-Davies, Perkins, Jones-Wade Birch-Jones",0-632k,1,United Kingdom,0,33.42110262,29.90359235,E06000023,"Bristol, City of",0.266415167,0.019113177,,68,L,Property,Other
442,Bolton,46 : Wholesale,"Green-Lawrence, Ali-Williams, McLean, Jones, Rowley-Fowler",0-632k,0,United Kingdom,0,1.700201604,2.18630695,E08000001,Bolton,0.434056521,0,,46,G,Wholesale,Shop
443,West Oxfordshire,"90-99 : Arts, entertainment, recreation & other","Weston, Walker-Thomas, Edwards, Wheeler, Smith-Cook",0-632k,0,United Kingdom,0,4.28305448,2.308589592,E07000181,West Oxfordshire,0.105525364,0,,90-99,S,"Arts, entertainment, recreation & other",Shop
444,Melton,41-43 : Construction,"Birch, King, Bowen, Khan, Ahmed-Hill",0-632k,1,United Kingdom,0,28.16708394,21.1766984,E07000133,Melton,1.208885895,1.113296321,,41-43,F,Construction,Factory
445,Winchester,47 : Retail,"Kerr, Williams, Morris, Warren, Houghton-Cartwright",0-632k,1,United Kingdom,0,4.818428795,3.338866334,E07000094,Winchester,0.613200383,0,,47,G,Retail,Shop
446,Solihull,05-39 : Production,"Manning, Parkinson-Davies, Campbell, Lewis, Knight, Jones, Hill",0-632k,1,United Kingdom,0,4.16188441,4.636994899,E08000029,Solihull,3.784046592,0,,May-39,C,Production,Shop
447,Harrow,58-63 : Information & communication,"Gardner, Nicholson, Hawkins, Jones, Anderson, Lewis, Knowles",0-632k,1,United Kingdom,0,59.95493523,54.13335378,E09000015,Harrow,0.052342607,0.006071416,,58-63,J,Information & communication,Other
448,Colchester,"01-03 : Agriculture, forestry & fishing","Jones, Archer, Saunders, Parry, Cox-Lawson",0-632k,1,United Kingdom,0,4.140326258,3.941639268,E07000071,Colchester,0.042485688,0,,01-Mar,A,"Agriculture, forestry & fishing",Office
449,Mid Ulster,86-88 : Health,"Smith-Bennett, Barnett, Mason, Andrews, Marsh-Clarke",0-632k,1,United Kingdom,,,,N09000009,Mid Ulster,,,,86-88,Q,Health,Factory
450,Havering,41-43 : Construction,"Graham, Miles, Cooke, Lambert, Barlow, Dawson, Wood",0-632k,1,United Kingdom,0,26.08766055,25.80491466,E09000016,Havering,1.192926848,1.222910255,,41-43,F,Construction,Factory
451,Teignbridge,85 : Education,"Ashton, Jones, Bailey, Walters, Brown, Smith, Steele",632k-10.2M,1,United Kingdom,0.019286747,15.39885009,15.06698985,E07000045,Teignbridge,1.052718023,0.005402485,,85,P,Education,Factory
452,Mid Devon,"01-03 : Agriculture, forestry & fishing","Finch, Johnson, Martin, Ali, Browne",0-632k,1,United Kingdom,0,15.94058995,19.43129038,E07000042,Mid Devon,0.028699526,0.00281596,,01-Mar,A,"Agriculture, forestry & fishing",Other
453,Leicester,55-56 : Accommodation & food services,"Watkins, Hargreaves, Walsh, Ali-Norris, Collins, Preston, Barton",0-632k,1,United Kingdom,0,2.222091799,3.589024335,E06000016,Leicester,0.398656462,0,,55-56,I,Accommodation & food services,Shop
454,Norwich,49-53 : Transport & Storage (inc. postal),"Saunders-Smart, Parry, Roberts, McCarthy, Cole",0-632k,1,United Kingdom,0.021676538,9.504192618,12.54694265,E07000148,Norwich,0.341983812,1.048390452,,49-53,H,Transport & Storage (inc. postal),Warehouse
455,Hammersmith and Fulham,64-66 : Finance & insurance,"Hargreaves, Berry, Cooke, Davis, Wood, Bryan, Hall",0-632k,1,United Kingdom,0,5.249219424,4.12265334,E09000013,Hammersmith and Fulham,0.025799105,0,,64-66,K,Finance & insurance,Office
456,Hertsmere,41-43 : Construction,"Clarke-Benson, Summers, Morton, Taylor, Thomson",0-632k,1,United Kingdom,0,93.49845301,96.47185158,E07000098,Hertsmere,0.352467301,0.226824312,,41-43,F,Construction,Other
457,Camden,77-82 : Business administration & support services,"Parker, Hughes-Adams, Stephenson, Kirby, Green-Carr",0-632k,1,United Kingdom,0,3.149714456,4.184254359,E09000007,Camden,0.094588294,0,,77-82,N,Business administration & support services,Shop
458,Dover,47 : Retail,"Harding, Edwards, Connolly-Thomas, Harrison, Cooper-Fox",0-632k,0,United Kingdom,0,7.05863516,8.754687979,E07000108,Dover,1.191394798,0,,47,G,Retail,Office
459,Sheffield,05-39 : Production,"Taylor, Davies, Williams, Hawkins-Bishop, Kennedy",0-632k,1,United Kingdom,0,2.34668515,2.77092466,E08000019,Sheffield,3.986711569,0,,May-39,C,Production,Shop
460,Cornwall,"69-75 : Professional, scientific & technical","Wood-Cooper, Clarke, Whitehead, Nelson, Holt-Bowen",0-632k,1,United Kingdom,0,2.253581517,1.664497195,E06000052,Cornwall,0.12438464,0,,69-75,M,"Professional, scientific & technical",Shop
461,Cornwall,55-56 : Accommodation & food services,"Clayton, Lynch, Campbell, Johnson-Hall, Newman",0-632k,1,United Kingdom,0,14.1158009,15.1007875,E06000052,Cornwall,0.301001022,0.00452,,55-56,I,Accommodation & food services,Other
462,Charnwood,55-56 : Accommodation & food services,"Cox, French, Robinson, Stone, Doherty",0-632k,1,United Kingdom,0,24.30556944,32.18772958,E07000130,Charnwood,0.680696364,0.009439259,,55-56,I,Accommodation & food services,Other
463,Causeway Coast and Glens,41-43 : Construction,"Martin-Roberts, Sutton, Khan-Alexander, Kaur, Hudson, Roberts, Rice",0-632k,1,United Kingdom,,,,N09000004,Causeway Coast and Glens,,,,41-43,F,Construction,Shop
464,Gedling,45 : Motor trades,"Archer-Reid, Daniels, Walsh-Wood, Iqbal, Hammond",0-632k,1,United Kingdom,0,11.11140303,36.75979316,E07000173,Gedling,1.205665134,0.4471927,,45,G,Motor trades,Factory
465,Hillingdon,41-43 : Construction,"Clark, Goodwin, King, Doyle-Stokes, Jones, Bates, Hancock",632k-10.2M,1,United Kingdom,0,19.76086819,16.61008269,E09000017,Hillingdon,1.086050426,0.622301113,,41-43,F,Construction,Warehouse
466,Redbridge,45 : Motor trades,"Davies, Taylor, Clarke, Clark, Price, May, Dixon",0-632k,1,United Kingdom,0,0.990621657,0.863215304,E09000026,Redbridge,0.130690632,0,,45,G,Motor trades,Shop
467,Kensington and Chelsea,77-82 : Business administration & support services,"Ward, Johnson, Peters, Hicks, Coleman-Thompson",0-632k,1,United Kingdom,0,2.840473947,2.629242344,E09000020,Kensington and Chelsea,0.054586515,0,,77-82,N,Business administration & support services,Shop
468,Lewisham,41-43 : Construction,"Harris-Carter, O'Neill, George, Peacock, Smith-Harrison",0-632k,1,United Kingdom,0,16.07855464,21.4828085,E09000023,Lewisham,0.528709586,0.658101842,,41-43,F,Construction,Factory
469,Westminster,47 : Retail,"Taylor-Martin, Evans, Ford, Jennings, Hill-Lowe",0-632k,1,United Kingdom,0,4.382525633,3.984391856,E09000033,Westminster,0.387590879,0,,47,G,Retail,Shop
470,Pembrokeshire,64-66 : Finance & insurance,"Morris, Faulkner, Tucker, Weston, Williams, James, Leach",0-632k,1,United Kingdom,0,18.66991648,3.308501034,W06000009,Pembrokeshire,0.041001206,0,,64-66,K,Finance & insurance,Office
471,Coventry,77-82 : Business administration & support services,"Taylor-Hill, Baldwin, Mills, Begum, Williams, Richards, Curtis",0-632k,1,United Kingdom,0,3.167262001,4.349831424,E08000026,Coventry,0.141909522,0,,77-82,N,Business administration & support services,Shop
472,North East Derbyshire,46 : Wholesale,"Clarke, Norton, Jenkins, Barry-Giles, Stevens-Jones",632k-10.2M,0,United Kingdom,0,4.857143546,3.130128763,E07000038,North East Derbyshire,0.56367337,0,,46,G,Wholesale,Shop
473,Bath and North East Somerset,46 : Wholesale,"Coles-Bowen, Reed, Page, Jackson, Payne, Greenwood, Herbert",0-632k,1,United Kingdom,0,17.85945254,19.33700151,E06000022,Bath and North East Somerset,0.386269536,0.063233428,,46,G,Wholesale,Other
474,York,05-39 : Production,"Gregory, Knowles, Griffiths, Knight, Dawson-Harris",0-632k,0,United Kingdom,0,4.794464961,6.889111036,E06000014,York,2.463011352,0,,May-39,B,Production,Office
475,Conwy,77-82 : Business administration & support services,"Brown, Jones, Jordan, Marshall, Adams",0-632k,1,United Kingdom,0,15.6763053,17.76783649,W06000003,Conwy,0.096790859,0.021573549,,77-82,N,Business administration & support services,Other
476,Westminster,86-88 : Health,"Thornton-Burton, Wilson, Phillips, Clayton Cox, Jones, Tomlinson",0-632k,0,United Kingdom,0,4.974296713,3.519650395,E09000033,Westminster,0.524359723,0,,86-88,Q,Health,Shop
477,Enfield,45 : Motor trades,"Bird-Turner, Forster, Wood, Mistry, Porter",0-632k,1,United Kingdom,0,1.705939153,2.018209824,E09000010,Enfield,0.334952793,0,,45,G,Motor trades,Shop
478,Kingston upon Thames,55-56 : Accommodation & food services,"Lewis-Jones, Shepherd, Stevenson-Lane, Wheeler, Holland-Bond",0-632k,1,United Kingdom,0,14.30654497,11.33827047,E09000021,Kingston upon Thames,1.860099522,0.026771732,,55-56,I,Accommodation & food services,Warehouse
479,West Lothian,41-43 : Construction,"Thompson, Cook, Owens, Hughes, Robson-Wood",0-632k,1,United Kingdom,,,,S12000040,West Lothian,,,,41-43,F,Construction,Shop
480,South Hams,"01-03 : Agriculture, forestry & fishing","Gardner-Patel, Morris, Jones, Smith, Cartwright-Carter",0-632k,1,United Kingdom,0,2.670881623,2.493710185,E07000044,South Hams,0.022903897,0,,01-Mar,A,"Agriculture, forestry & fishing",Shop
481,South Gloucestershire,58-63 : Information & communication,"Mitchell-Wilson, Clark, Rees-Patterson, Stevens White-Schofield",0-632k,1,United Kingdom,0,9.330140765,9.373671653,E06000025,South Gloucestershire,0.202194122,0.026490796,,58-63,J,Information & communication,Warehouse
482,Braintree,05-39 : Production,"Simpson, Walker, Wood, Evans-Tomlinson, Chapman, Smith, Osborne",0-632k,1,United Kingdom,0,5.141585975,4.030288922,E07000067,Braintree,9.903138614,0,,May-39,C,Production,Office
483,East Northamptonshire,55-56 : Accommodation & food services,"Smith, Grant, Randall, Humphreys, Smith, Page, Day",0-632k,0,United Kingdom,0,21.9414119,13.127501,E07000152,East Northamptonshire,1.12028865,0.037064266,,55-56,I,Accommodation & food services,Other
484,Milton Keynes,77-82 : Business administration & support services,"Woods, Edwards, French, Morgan, Jarvis-Johnson",0-632k,1,United Kingdom,0,6.616549847,4.799337662,E06000042,Milton Keynes,0.363657698,0,,77-82,N,Business administration & support services,Office
485,Ealing,41-43 : Construction,"Wong, Chambers, Davison, Holland-Cameron, Poole, Evans, Long",0-632k,1,United Kingdom,0,10.67314955,8.277101094,E09000009,Ealing,0.740346431,0.320149779,,41-43,F,Construction,Warehouse
486,North East Lincolnshire,"90-99 : Arts, entertainment, recreation & other","Mitchell, Harvey, Davies-Yates, Taylor-Smith Moss",0-632k,1,United Kingdom,0,27.90152189,74.12008169,E06000012,North East Lincolnshire,0.231784056,0.004228368,,90-99,S,"Arts, entertainment, recreation & other",Other
487,Birmingham,77-82 : Business administration & support services,"Harris, Roberts, Edwards, Thomas Jenkins",0-632k,1,United Kingdom,0,6.07911908,7.177839782,E08000025,Birmingham,0.185480352,0,,77-82,N,Business administration & support services,Office
488,Hillingdon,77-82 : Business administration & support services,"Middleton, Hart, Wallace, Butler, Hicks, Brown, Nicholson",0-632k,1,United Kingdom,0,3.972222612,3.01888257,E09000017,Hillingdon,0.125606011,0,,77-82,N,Business administration & support services,Shop
489,Cornwall,45 : Motor trades,"Pope, Johnson, Morrison, Akhtar-Reed, Hussain",0-632k,1,United Kingdom,0,7.456867646,6.985362012,E06000052,Cornwall,0.965784717,0.190610297,,45,G,Motor trades,Warehouse
490,Cannock Chase,"01-03 : Agriculture, forestry & fishing","Begum-Herbert, Woodward, Harvey, Haynes, Collins, Wright, Phillips",0-632k,1,United Kingdom,0.000556212,8.975915844,9.984528926,E07000192,Cannock Chase,0.111585246,0.054615318,,01-Mar,A,"Agriculture, forestry & fishing",Factory
491,Birmingham,55-56 : Accommodation & food services,"Nash-Nicholson, Walker-Knight, Chamberlain, Knowles, Robinson",0-632k,1,United Kingdom,0,28.02593875,31.1588188,E08000025,Birmingham,0.850627645,0.010459618,,55-56,I,Accommodation & food services,Other
492,Basildon,85 : Education,"Brooks, Thompson, Kaur, Stevenson-Short, King, Moss, Chandler",632k-10.2M,1,United Kingdom,0.018402725,11.09482023,7.922307504,E07000066,Basildon,1.054280324,0.005406198,,85,P,Education,Warehouse
493,Tamworth,"90-99 : Arts, entertainment, recreation & other","Smith, Cooper, Smith, Smith, Jones",0-632k,1,United Kingdom,0,22.00264473,25.93239107,E07000199,Tamworth,0.232955966,0.008164388,,90-99,R,"Arts, entertainment, recreation & other",Other
494,Wirral,"69-75 : Professional, scientific & technical","Swift, Ross, Weston, White, Brown, Robinson, Norman",0-632k,1,United Kingdom,0,8.493288668,14.42336588,E08000015,Wirral,0.544964764,0,,69-75,M,"Professional, scientific & technical",Office
495,Trafford,58-63 : Information & communication,"Walters, Allen, Webster, Payne-Davies, Bailey",0-632k,0,United Kingdom,0,21.00178828,34.27365842,E08000009,Trafford,0.269183825,0.130705934,,58-63,J,Information & communication,Warehouse
496,Redbridge,49-53 : Transport & Storage (inc. postal),"Bates, Smith, Khan, Green, Fuller-Martin",0-632k,1,United Kingdom,0,3.466343912,3.699570218,E09000026,Redbridge,0.096211862,0,,49-53,H,Transport & Storage (inc. postal),Office
497,Tower Hamlets,"90-99 : Arts, entertainment, recreation & other","Cunningham, Carter-Griffiths, Bruce, Hilton, Reynolds, Sinclair, Hobbs",0-632k,1,United Kingdom,0,38.08904412,15.77069745,E09000030,Tower Hamlets,0.309597421,0.015880154,,90-99,S,"Arts, entertainment, recreation & other",Factory
498,Shropshire,"90-99 : Arts, entertainment, recreation & other","Hammond, Martin-Jones, Williamson-Moore, Ball-King Lewis-Taylor",0-632k,1,United Kingdom,0,2.868632515,2.986635599,E06000051,Shropshire,0.092337784,0,,90-99,S,"Arts, entertainment, recreation & other",Shop
499,Northumberland,"90-99 : Arts, entertainment, recreation & other","Gray-Patel, Ball-Hill, Ahmed, Gregory, Wilson, Mills, Jones",0-632k,0,United Kingdom,0,18.34110262,16.90664833,E06000057,Northumberland,0.321449003,0.008941688,,90-99,S,"Arts, entertainment, recreation & other",Warehouse
500,Hart,"69-75 : Professional, scientific & technical","Taylor, Rees, Watson, Price, Kennedy-Davies",0-632k,1,United Kingdom,0,34.83666805,17.47070355,E07000089,Hart,0.158293244,0.014885304,,69-75,M,"Professional, scientific & technical",Other
501,Dacorum,49-53 : Transport & Storage (inc. postal),"Anderson, Little, Elliott, Rogers-Savage, Andrews-Lloyd",0-632k,1,United Kingdom,0,6.737912359,4.614478128,E07000096,Dacorum,0.187280967,0,,49-53,H,Transport & Storage (inc. postal),Office
502,Westminster,41-43 : Construction,"Noble, Humphreys-Frost, Wilson, Jennings, Wright, Nash, Rowley",0-632k,1,United Kingdom,0,4.584774649,3.800529501,E09000033,Westminster,0.196729462,0,,41-43,F,Construction,Shop
503,Brent,"69-75 : Professional, scientific & technical","Clark, Peters, Taylor, Robertson, Hilton",0-632k,1,United Kingdom,0,10.83721258,7.773865318,E09000005,Brent,0.363465138,0.032200172,,69-75,M,"Professional, scientific & technical",Warehouse
504,Hillingdon,77-82 : Business administration & support services,"Glover, Green, Bradley, King, Richards, White, Allen",0-632k,1,United Kingdom,0,4.28306114,2.799737593,E09000017,Hillingdon,0.136267267,0,,77-82,N,Business administration & support services,Shop
505,Vale of Glamorgan,58-63 : Information & communication,"Russell-Brown, Griffiths, Simmons, Smith, Gray-Evans",0-632k,1,United Kingdom,0,10.61321872,7.290427196,W06000014,Vale of Glamorgan,0.136959657,0,,58-63,J,Information & communication,Office
506,Highland,47 : Retail,"Robertson-Clarke, Lawrence-Thompson, Roberts-Townsend, Martin, Evans, Brown, Carpenter",0-632k,1,United Kingdom,,,,S12000017,Highland,,,,47,G,Retail,Other
507,Hackney,41-43 : Construction,"Austin-Peacock, Stokes-Taylor, Young, Ashton, Gardiner, Adams, Thomas",0-632k,1,United Kingdom,0,2.499160146,1.915207513,E09000012,Hackney,0.128927913,0,,41-43,F,Construction,Office
508,Perth and Kinross,"69-75 : Professional, scientific & technical","Osborne, Atkins, Dickinson, Smith, Buckley",0-632k,1,United Kingdom,,,,S12000048,Perth and Kinross,,,,69-75,M,"Professional, scientific & technical",Other
509,North Somerset,46 : Wholesale,"Fisher, Young, Smith, Bryan, Stevens-Weston",0-632k,1,United Kingdom,0,19.27696167,32.54871634,E06000024,North Somerset,1.437304907,0.515062698,,46,G,Wholesale,Factory
510,Windsor and Maidenhead,77-82 : Business administration & support services,"Burrows, Murray, Evans, Clark Kay, Brown, Banks",0-632k,0,United Kingdom,0,5.033085218,5.579433552,E06000040,Windsor and Maidenhead,0.130225233,0,,77-82,N,Business administration & support services,Office
511,Leeds,"69-75 : Professional, scientific & technical","Wilson, Begum, Harrison, Yates, Wilkinson, Walker, Carter",0-632k,1,United Kingdom,0,2.831451316,4.148478525,E08000035,Leeds,0.255498886,0,,69-75,M,"Professional, scientific & technical",Office
512,Cornwall,"69-75 : Professional, scientific & technical","Scott, Khan, Wade, Ward, Hill, Marshall, Reynolds",0-632k,1,United Kingdom,0,8.106881926,6.773263976,E06000052,Cornwall,0.42601099,0,,69-75,M,"Professional, scientific & technical",Office
513,Uttlesford,"01-03 : Agriculture, forestry & fishing","Townsend-Fletcher, Baker, Stephenson, Williams, Smith-McKenzie",0-632k,0,United Kingdom,0.000243012,9.252695163,5.411459231,E07000077,Uttlesford,0.053755031,0.021333021,,01-Mar,A,"Agriculture, forestry & fishing",Warehouse
514,Rutland,47 : Retail,"Martin-Goddard, Green-Matthews, Evans, Martin, Barker",0-632k,1,United Kingdom,0,9.120190214,2.722703957,E06000017,Rutland,0.465287751,0,,47,G,Retail,Shop
515,South Hams,05-39 : Production,"Curtis-Taylor, Buckley, Mistry, Collins, Ali-Walters",0-632k,1,United Kingdom,0,15.28279401,15.01117504,E07000044,South Hams,1.394753941,0.000643943,,May-39,B,Production,Other
516,Sandwell,46 : Wholesale,"Cooke, Browne-Hutchinson, Rees, Young, Shaw, Brown, Taylor",0-632k,1,United Kingdom,0,7.44475482,10.4487769,E08000028,Sandwell,1.467602266,0.282118781,,46,G,Wholesale,Warehouse
517,Isle of Wight,55-56 : Accommodation & food services,"Bradley-Davis, Shah, Scott, Foster, Turner-Ali",0-632k,0,United Kingdom,0,15.78660212,21.21119438,E06000046,Isle of Wight,0.365441921,0.01083683,,55-56,I,Accommodation & food services,Other
518,Sutton,41-43 : Construction,"Price-Gibson, Gray, Jones, Begum, Russell",0-632k,1,United Kingdom,0,18.07194889,12.0030025,E09000029,Sutton,0.646158084,0.423261625,,41-43,F,Construction,Warehouse
519,Bury,05-39 : Production,"Tomlinson-Young, Hamilton, Murray, Roberts, Powell, Thomas, Webb",0-632k,1,United Kingdom,0.063010677,18.90457071,18.89987488,E08000002,Bury,7.166561649,0.005809983,,May-39,B,Production,Factory
520,Blackpool,47 : Retail,"Cook, Thornton, Birch, Fletcher, Kirk, Swift, Moss",0-632k,1,United Kingdom,0,26.13927685,33.74934041,E06000009,Blackpool,0.441371482,0.07474917,,47,G,Retail,Other
521,Chelmsford,"69-75 : Professional, scientific & technical","Robinson-White, Lord, Bennett-Young, Dobson, Smith, Powell, Andrews",0-632k,1,United Kingdom,0,20.60371219,14.30375967,E07000070,Chelmsford,0.630875671,0.243142362,,69-75,M,"Professional, scientific & technical",Factory
522,Angus,41-43 : Construction,"Richards-Carter, Greenwood, Sinclair, Leonard, Leach-Mitchell",0-632k,1,United Kingdom,,,,S12000041,Angus,,,,41-43,F,Construction,Factory
523,Windsor and Maidenhead,68 : Property,"Coleman, Richardson-Hussain, Lowe-Evans, Ball Smith",0-632k,1,United Kingdom,0,6.197645621,4.225097268,E06000040,Windsor and Maidenhead,0.115377086,0,,68,L,Property,Office
524,Renfrewshire,49-53 : Transport & Storage (inc. postal),"Burgess-Franklin, Powell-Reid, Thompson-Lewis, Wilson Horton, Edwards, Smith",0-632k,1,United Kingdom,,,,S12000038,Renfrewshire,,,,49-53,H,Transport & Storage (inc. postal),Warehouse
525,Hammersmith and Fulham,86-88 : Health,"Powell-Pearce, Johnston-Reynolds, Jones, Wallis-Berry Wells",0-632k,0,United Kingdom,0,4.849409074,4.159628953,E09000013,Hammersmith and Fulham,0.609692236,0,,86-88,Q,Health,Office
526,Cheshire East,45 : Motor trades,"Hamilton, Pritchard, Ball, Evans, Ball, Ahmed, Harris",0-632k,1,United Kingdom,0,26.24817535,44.51355148,E06000049,Cheshire East,0.707221801,0.097611965,,45,G,Motor trades,Other
527,Croydon,49-53 : Transport & Storage (inc. postal),"Jones-Brown, Taylor-Kelly, Robinson, Collins, Bull-Knight",0-632k,1,United Kingdom,0,1.683806782,1.37449131,E09000008,Croydon,0.039041224,0,,49-53,H,Transport & Storage (inc. postal),Shop
528,Dacorum,"69-75 : Professional, scientific & technical","Booth-Donnelly, Connolly, Banks, Lewis Burns, Harris, Wilson",0-632k,1,United Kingdom,0,3.548970841,1.922167289,E07000096,Dacorum,0.207586955,0,,69-75,M,"Professional, scientific & technical",Shop
529,Havering,"01-03 : Agriculture, forestry & fishing","Cooper, Herbert, Wilkinson, Edwards-Hayward, Fisher-Ball",0-632k,1,United Kingdom,0,1.726115048,1.024337561,E09000016,Havering,0.015200067,0,,01-Mar,A,"Agriculture, forestry & fishing",Shop
530,King's Lynn and West Norfolk,58-63 : Information & communication,"Thompson-Davies, Collins, Brown, Young, Allen",0-632k,1,United Kingdom,0,5.538771011,18.37218212,E07000146,King's Lynn and West Norfolk,0.059660529,0,,58-63,J,Information & communication,Shop
531,Maidstone,45 : Motor trades,"Smith, Hooper, Knight, Mills, Bailey",632k-10.2M,1,United Kingdom,0,5.087998972,3.605948121,E07000110,Maidstone,0.516374149,0,,45,G,Motor trades,Office
532,Lisburn and Castlereagh,41-43 : Construction,"Hicks, Patel-Gough, Kemp, McDonald Harris, Cooper, Bennett",0-632k,1,United Kingdom,,,,N09000007,Lisburn and Castlereagh,,,,41-43,F,Construction,Warehouse
533,Somerset West and Taunton,77-82 : Business administration & support services,"Holmes, Thompson, Clark, Walters, Hale, Davies, Brown",0-632k,1,United Kingdom,0,7.057377246,5.747384173,E07000190,Somerset West and Taunton,0.259706326,0.062811857,,77-82,N,Business administration & support services,Warehouse
534,Cherwell,"69-75 : Professional, scientific & technical","Marshall, Tucker, Moore-Ryan, Simmons Bell, Williams, Reeves",0-632k,1,United Kingdom,0,5.669188111,9.62157409,E07000177,Cherwell,0.439885098,0,,69-75,M,"Professional, scientific & technical",Office
535,York,86-88 : Health,"Faulkner-Davies, Rose-Fisher, Jones, Holloway, Kelly",632k-10.2M,1,United Kingdom,0,2.298940128,3.362560702,E06000014,York,0.455132396,0,,86-88,Q,Health,Shop
536,Tandridge,"69-75 : Professional, scientific & technical","Daly, Hall, Watkins, Anderson, Kemp",0-632k,1,United Kingdom,0,5.803771315,5.632165253,E07000215,Tandridge,0.317950678,0.033846597,,69-75,M,"Professional, scientific & technical",Warehouse
537,Cheshire East,49-53 : Transport & Storage (inc. postal),"Atkins-Morgan, Whitehead-Hammond, Archer, Roberts, Andrews, Taylor, Morris",0-632k,1,United Kingdom,0,26.66464538,43.52440587,E06000049,Cheshire East,0.175025106,0.38725642,,49-53,H,Transport & Storage (inc. postal),Other
538,New Forest,"69-75 : Professional, scientific & technical","Bowen, Chandler, Fletcher, Webster, Evans, Robinson, Atkinson",0-632k,1,United Kingdom,0,17.89835128,10.06327932,E07000091,New Forest,0.494389161,0.069679598,,69-75,M,"Professional, scientific & technical",Factory
539,Dorset,"01-03 : Agriculture, forestry & fishing","Burrows, Shepherd, Clark, Davis, James",0-632k,1,United Kingdom,0,6.141295713,5.745531704,E10000009,Dorset,0.062275246,0,,01-Mar,A,"Agriculture, forestry & fishing",Office
540,West Devon,"01-03 : Agriculture, forestry & fishing","Hill, Bull, Hopkins, Walsh, Walker",0-632k,1,United Kingdom,0,2.484887245,2.352746205,E07000047,West Devon,0.022926994,0,,01-Mar,A,"Agriculture, forestry & fishing",Shop
541,Wokingham,55-56 : Accommodation & food services,"Andrews, Newman-Taylor, Patel-Price, Bruce, James",0-632k,1,United Kingdom,0,15.57087645,7.559222002,E06000041,Wokingham,1.64511322,0.020475012,,55-56,I,Accommodation & food services,Warehouse
542,High Peak,68 : Property,"Greenwood-Howell, Carter, Gibson, Murray, Nash, Doyle, Taylor",0-632k,1,United Kingdom,0,37.58471758,43.10061582,E07000037,High Peak,0.267280951,0.02499883,,68,L,Property,Factory
543,Allerdale,55-56 : Accommodation & food services,"Harrison, Patel, Walker, Ward, Stevenson-Hall",0-632k,1,United Kingdom,0,2.454565306,6.345596337,E07000026,Allerdale,0.418540265,0,,55-56,I,Accommodation & food services,Shop
544,Canterbury,47 : Retail,"Davies, Khan, Kaur, Dickinson-Johnson, Humphreys",0-632k,1,United Kingdom,0,36.47932796,41.88540793,E07000106,Canterbury,0.298478889,0.06631875,,47,G,Retail,Other
545,South Norfolk,05-39 : Production,"Pearce, James, Connolly, Singh, Allen-Hunter",0-632k,1,United Kingdom,0,4.33847295,3.197740224,E07000149,South Norfolk,4.899128956,0,,May-39,C,Production,Shop
546,Shropshire,55-56 : Accommodation & food services,"Miller, Parsons, Fitzgerald, Cox-Stevens, Mitchell-Jackson",0-632k,1,United Kingdom,0,9.155300257,9.382153867,E06000051,Shropshire,1.047643052,0.039835623,,55-56,I,Accommodation & food services,Warehouse
547,Forest of Dean,41-43 : Construction,"Allen, Hyde, Turner, Davies-Ball, Hughes-Warren",0-632k,1,United Kingdom,0,13.87636035,18.05142428,E07000080,Forest of Dean,0.436724173,0.532610902,,41-43,F,Construction,Factory
548,Causeway Coast and Glens,"69-75 : Professional, scientific & technical","Hughes, Brookes, Clayton, Ryan, Simpson-Watson",0-632k,1,United Kingdom,,,,N09000004,Causeway Coast and Glens,,,,69-75,M,"Professional, scientific & technical",Shop
549,East Staffordshire,55-56 : Accommodation & food services,"Murphy, Green, Moore, Brown, Day, Campbell, Thomas",0-632k,0,United Kingdom,0,12.22832602,14.40080745,E07000193,East Staffordshire,1.828850384,0,,55-56,I,Accommodation & food services,Office
